{
  "schema_version": "1.0.0",
  "language": "zh-CN",
  "target_models": [
    "Z-Image",
    "Z-Image-Turbo"
  ],
  "validation": {
    "language_rules": "passed",
    "model_image_tests": "pending"
  },
  "fields": {
    "pose.base": {
      "category": "姿态动作",
      "label": "基础姿态",
      "template": "人物{value}",
      "options": [
        {
          "id": "standing_relaxed",
          "label": "自然站立",
          "value": "自然站立，躯干保持舒展"
        },
        {
          "id": "standing_three_quarter",
          "label": "侧身站立",
          "value": "以三分之二侧身方向站立"
        },
        {
          "id": "standing_doorway",
          "label": "门框间站立",
          "value": "站在半开的门框之间"
        },
        {
          "id": "leaning_wall",
          "label": "墙边轻靠",
          "value": "肩背轻靠简洁墙面站立"
        },
        {
          "id": "walking_pause",
          "label": "行走中停步",
          "value": "在向前行走时短暂停步"
        },
        {
          "id": "sitting_chair_edge",
          "label": "椅子前缘坐姿",
          "value": "坐在椅子前缘，背部自然挺直"
        },
        {
          "id": "sitting_sofa_forward",
          "label": "沙发前倾坐姿",
          "value": "坐在沙发边缘并轻微向镜头前倾"
        },
        {
          "id": "sitting_sofa_relaxed",
          "label": "沙发放松坐姿",
          "value": "坐在沙发上，身体轻微后靠"
        },
        {
          "id": "sitting_booth_relaxed",
          "label": "卡座放松坐姿",
          "value": "坐在卡座上，身体轻微后靠"
        },
        {
          "id": "sitting_stool",
          "label": "高脚椅坐姿",
          "value": "坐在高脚椅前缘，躯干稳定舒展"
        },
        {
          "id": "crouching_sport",
          "label": "运动式低位蹲姿",
          "value": "以稳定的运动式低位姿态蹲下，背部自然前倾"
        },
        {
          "id": "squat",
          "label": "蹲姿",
          "value": "呈低位蹲姿"
        },
        {
          "id": "kneel_sit",
          "label": "跪坐",
          "value": "以跪坐姿势"
        },
        {
          "id": "cross_legged",
          "label": "盘腿而坐",
          "value": "盘腿而坐"
        },
        {
          "id": "hand_on_hip",
          "label": "叉腰站立",
          "value": "叉腰站立"
        },
        {
          "id": "standing_with_sword",
          "label": "持剑站立",
          "value": "持剑自然站立"
        },
        {
          "id": "horseback_sitting",
          "label": "马背坐姿",
          "value": "骑在马背上的坐姿"
        },
        {
          "id": "cycling_posture",
          "label": "骑行姿态",
          "value": "骑行时身体前倾的姿态"
        },
        {
          "id": "sitting_pool_edge",
          "label": "泳池边坐姿",
          "value": "坐在泳池边缘，上身自然直立"
        }
      ]
    },
    "pose.body_direction": {
      "category": "姿态动作",
      "label": "身体方向",
      "template": "{value}",
      "options": [
        {
          "id": "front",
          "label": "正面朝向镜头",
          "value": "身体正面朝向镜头"
        },
        {
          "id": "left_quarter",
          "label": "左侧三分之二身",
          "value": "身体轻微转向画面左侧，保留三分之二正面"
        },
        {
          "id": "right_quarter",
          "label": "右侧三分之二身",
          "value": "身体轻微转向画面右侧，保留三分之二正面"
        },
        {
          "id": "left_profile",
          "label": "左侧侧身",
          "value": "身体侧向画面左侧"
        },
        {
          "id": "right_profile",
          "label": "右侧侧身",
          "value": "身体侧向画面右侧"
        },
        {
          "id": "back_turn_left",
          "label": "背身向左回转",
          "value": "身体背向镜头并向左侧轻微回转"
        },
        {
          "id": "back_turn_right",
          "label": "背身向右回转",
          "value": "身体背向镜头并向右侧轻微回转"
        },
        {
          "id": "diagonal_forward",
          "label": "斜向镜头前方",
          "value": "身体沿画面对角线朝镜头方向展开"
        },
        {
          "id": "three_quarter_back",
          "label": "四分之三背身",
          "value": "四分之三背身朝向右后方"
        }
      ]
    },
    "pose.weight": {
      "category": "姿态动作",
      "label": "身体重心",
      "template": "{value}",
      "options": [
        {
          "id": "balanced_both_feet",
          "label": "双脚均衡承重",
          "value": "身体重心均衡落在双脚之间"
        },
        {
          "id": "left_leg",
          "label": "左腿承重",
          "value": "身体重心主要落在左腿"
        },
        {
          "id": "right_leg",
          "label": "右腿承重",
          "value": "身体重心主要落在右腿"
        },
        {
          "id": "forward",
          "label": "重心轻微前移",
          "value": "身体重心轻微前移"
        },
        {
          "id": "back",
          "label": "重心轻微后移",
          "value": "身体重心轻微后移"
        },
        {
          "id": "left_hip",
          "label": "重心落向左侧坐骨",
          "value": "坐姿重心自然落向左侧坐骨"
        },
        {
          "id": "right_hip",
          "label": "重心落向右侧坐骨",
          "value": "坐姿重心自然落向右侧坐骨"
        },
        {
          "id": "centered_seated",
          "label": "坐姿重心居中",
          "value": "坐姿重心稳定居中"
        }
      ]
    },
    "pose.shoulders": {
      "category": "姿态动作",
      "label": "肩颈状态",
      "template": "{value}",
      "options": [
        {
          "id": "relaxed_level",
          "label": "双肩放松平稳",
          "value": "双肩自然放松并保持平稳"
        },
        {
          "id": "relaxed_inward",
          "label": "肩膀轻微内收",
          "value": "双肩轻微内收，肩颈线条柔和"
        },
        {
          "id": "one_shoulder_forward",
          "label": "一侧肩膀前移",
          "value": "靠近镜头的一侧肩膀轻微前移"
        },
        {
          "id": "one_shoulder_lower",
          "label": "一侧肩膀降低",
          "value": "一侧肩膀自然降低，形成轻微高低变化"
        },
        {
          "id": "open_chest",
          "label": "肩背舒展",
          "value": "肩背自然舒展，颈部保持挺直"
        },
        {
          "id": "forward_relaxed",
          "label": "前倾时肩颈放松",
          "value": "上身前倾时双肩保持放松，颈部自然延伸"
        },
        {
          "id": "shrug",
          "label": "轻微耸肩",
          "value": "轻微耸肩"
        },
        {
          "id": "shoulders_back",
          "label": "双肩向后打开",
          "value": "双肩向后打开"
        }
      ]
    },
    "pose.hand_action": {
      "category": "姿态动作",
      "label": "手部动作",
      "template": "{value}",
      "options": [
        {
          "id": "arms_relaxed_sides",
          "label": "双臂自然垂落",
          "value": "双臂沿身体两侧自然垂落，手指保持放松"
        },
        {
          "id": "hands_folded_front",
          "label": "双手身前轻握",
          "value": "双手在身前轻轻交叠，手指关系清楚"
        },
        {
          "id": "one_hand_waist",
          "label": "一手轻扶腰侧",
          "value": "一只手轻扶腰侧，另一只手自然垂落"
        },
        {
          "id": "one_hand_pocket",
          "label": "一手插入口袋",
          "value": "一只手自然插入口袋，另一只手沿身体侧边放松"
        },
        {
          "id": "adjust_collar",
          "label": "一手轻扶衣领",
          "value": "一只手轻扶衣领边缘，另一只手自然垂落"
        },
        {
          "id": "adjust_glasses",
          "label": "一手轻扶镜框",
          "value": "一只手轻扶眼镜镜框，另一只手保持自然放松",
          "requires": {
            "clothing.accessory": [
              "rectangle_glasses",
              "round_glasses"
            ]
          }
        },
        {
          "id": "glasses_and_folder",
          "label": "扶镜框并拿文件夹",
          "value": "一只手轻扶眼镜镜框，另一只手拿住文件夹边缘",
          "requires": {
            "clothing.accessory": [
              "rectangle_glasses",
              "round_glasses"
            ],
            "prop": [
              "folder"
            ]
          }
        },
        {
          "id": "touch_hair",
          "label": "一手整理脸侧发丝",
          "value": "一只手轻触脸侧发丝，手指与发丝关系清楚"
        },
        {
          "id": "hold_hat_brim",
          "label": "一手轻扶帽檐",
          "value": "一只手轻扶帽檐，另一只手自然垂落",
          "requires": {
            "hair.headwear": [
              "straw_hat",
              "wide_brim_hat",
              "baseball_cap"
            ]
          }
        },
        {
          "id": "bouquet_and_hat",
          "label": "抱花束并扶帽檐",
          "value": "一只手臂抱住花束，另一只手轻扶帽檐",
          "requires": {
            "prop": [
              "flower_bouquet"
            ],
            "hair.headwear": [
              "straw_hat",
              "wide_brim_hat"
            ]
          }
        },
        {
          "id": "hold_coffee_cup",
          "label": "双手托住咖啡杯",
          "value": "双手自然托住咖啡杯，杯身位于胸部下方",
          "requires": {
            "prop": [
              "coffee_cup"
            ]
          }
        },
        {
          "id": "cup_and_table",
          "label": "一手托杯一手扶桌",
          "value": "一只手托住咖啡杯，另一只手轻扶桌沿",
          "requires": {
            "prop": [
              "coffee_cup",
              "table"
            ]
          }
        },
        {
          "id": "hold_folder",
          "label": "双手拿文件夹",
          "value": "双手拿住竖立的文件夹，手指沿文件夹边缘自然展开",
          "requires": {
            "prop": [
              "folder"
            ]
          }
        },
        {
          "id": "pen_and_folder",
          "label": "签字笔与文件夹",
          "value": "一只手握住文件夹，另一只手夹着签字笔轻触太阳穴",
          "requires": {
            "prop": [
              "folder",
              "pen"
            ]
          }
        },
        {
          "id": "door_handle_and_fan",
          "label": "门把手与折扇",
          "value": "一只手握住门把手，另一只手在肩侧举起折扇",
          "requires": {
            "prop": [
              "door_handle",
              "folding_fan"
            ]
          }
        },
        {
          "id": "hold_handbag",
          "label": "双手轻握手袋",
          "value": "双手在身前轻握手袋提手，手袋位于身体侧前方",
          "requires": {
            "clothing.accessory": [
              "structured_handbag"
            ]
          }
        },
        {
          "id": "touch_railing",
          "label": "一手轻扶栏杆",
          "value": "一只手轻扶栏杆，另一只手沿身体侧边放松",
          "requires": {
            "prop": [
              "railing"
            ]
          }
        },
        {
          "id": "touch_curtain",
          "label": "一手轻触窗帘",
          "value": "一只手轻触窗帘边缘，另一只手自然放在腰侧",
          "requires": {
            "prop": [
              "curtain"
            ]
          }
        },
        {
          "id": "hold_umbrella",
          "label": "单手握伞",
          "value": "一只手稳定握住伞柄，另一只手自然垂落",
          "requires": {